[
  {
    "id": 1,
    "status": "trial",
    "catalog_id": 1,
    "period_start": "2015-07-17",
    "sku_used": 100,
    "created_at": "2015-07-17 09:54:00",
    "updated_at": "2015-07-17 09:54:00"
  },
  {
    "id": 2,
    "status": "active",
    "catalog_id": 1,
    "period_start": "2015-07-17",
    "sku_used": 5000,
    "created_at": "2015-07-17 09:54:00",
    "updated_at": "2015-07-17 09:54:00"
  },
  {
    "id": 3,
    "status": "active",
    "catalog_id": 2,
    "period_start": "2015-07-17",
    "period_expire": "2015-10-17",
    "sku_quantity": 1000,
    "sku_used": 1000,
    "created_at": "2015-07-17 11:01:14",
    "updated_at": "2015-07-17 11:01:14"
  }
]
